{
  "baseline": {"ctq_values": {"ACID": 2.2, "VI": 90.0}, "proportions": {"A": 0.3333333333333333, "B": 0.3333333333333333, "C": 0.3333333333333334}, "total_cost": 20.0},
  "candidate_space": {"bounds": [{"component_id": "A", "lower": 0.0, "upper": 1.0}, {"component_id": "B", "lower": 0.0, "upper": 1.0}, {"component_id": "C", "lower": 0.0, "upper": 1.0}], "component_ids": ["A", "B", "C"], "grid_resolution": 5},
  "cost_input": {"formula_template": {"components": [{"component_id": "A"}, {"component_id": "B"}, {"component_id": "C"}], "formula_id": "OPT-GOLD", "version": "1"}, "materials": [{"category": "BASE_OIL", "currency": "CNY", "effective_date": "2026-08-01", "material_id": "A", "name": "A", "price": 30.0, "unit": "CNY_PER_KG"}, {"category": "BASE_OIL", "currency": "CNY", "effective_date": "2026-08-01", "material_id": "B", "name": "B", "price": 20.0, "unit": "CNY_PER_KG"}, {"category": "ADDITIVE", "currency": "CNY", "effective_date": "2026-08-01", "material_id": "C", "name": "C", "price": 10.0, "unit": "CNY_PER_KG"}], "price_timestamp": "2026-08-01"},
  "guardrails": [{"ctq_reference": "VI", "direction": "HIGHER_IS_BETTER", "guardrail_id": "G-VI", "minimum_margin": -12.0, "tolerance_mode": "RELATIVE_PERCENT"}, {"ctq_reference": "ACID", "direction": "LOWER_IS_BETTER", "guardrail_id": "G-ACID", "minimum_margin": -15.0, "tolerance_mode": "RELATIVE_PERCENT"}],
  "hard_constraints": [{"constraint_id": "COST-CAP", "direction": "MINIMIZE", "reference_id": "COST", "threshold": 27.5}],
  "input_type": "OPTIMIZATION_REQUEST", "max_recommendations": 5, "ranking_method": "PARETO",
  "non_inferiority": [],
  "source_doe_design_points": [{"proportions": {"A": 1.0, "B": 0.0, "C": 0.0}}, {"proportions": {"A": 0.0, "B": 1.0, "C": 0.0}}, {"proportions": {"A": 0.0, "B": 0.0, "C": 1.0}}],
  "statistical_models": [{"coefficients": [{"estimate": 100.0, "term": "x_A"}, {"estimate": 90.0, "term": "x_B"}, {"estimate": 80.0, "term": "x_C"}, {"estimate": 8.0, "term": "x_A*x_B"}, {"estimate": 4.0, "term": "x_A*x_C"}, {"estimate": 2.0, "term": "x_B*x_C"}], "ctq_reference": "VI", "model_order": "QUADRATIC", "r_squared": 0.99, "sigma_squared": 0.1, "term_order": ["x_A", "x_B", "x_C", "x_A*x_B", "x_A*x_C", "x_B*x_C"]}, {"coefficients": [{"estimate": 1.0, "term": "x_A"}, {"estimate": 2.0, "term": "x_B"}, {"estimate": 3.0, "term": "x_C"}, {"estimate": 0.0, "term": "x_A*x_B"}, {"estimate": 0.0, "term": "x_A*x_C"}, {"estimate": 0.0, "term": "x_B*x_C"}], "ctq_reference": "ACID", "model_order": "QUADRATIC", "r_squared": 0.98, "sigma_squared": 0.2, "term_order": ["x_A", "x_B", "x_C", "x_A*x_B", "x_A*x_C", "x_B*x_C"]}]
}
